Time           No.     Source                Destination           Protocol Length Info
1.068214850        103 10.1.17.80            128.119.245.12        TCP      74     53252 → 80 [SYN] Seq=0 Win=64240 Len=0 MSS=1460 SACK_PERM TSval=2214311573 TSecr=0 WS=128

Frame 103: 74 bytes on wire (592 bits), 74 bytes captured (592 bits) on interface enp2s0f1, id 0
    Section number: 1
    Interface id: 0 (enp2s0f1)
        Interface name: enp2s0f1
    Encapsulation type: Ethernet (1)
    Arrival Time: Mar 12, 2025 16:22:34.445566596 -03
    UTC Arrival Time: Mar 12, 2025 19:22:34.445566596 UTC
    Epoch Arrival Time: 1741807354.445566596
    [Time shift for this packet: 0.000000000 seconds]
    [Time delta from previous captured frame: 0.000179981 seconds]
    [Time delta from previous displayed frame: 0.172849194 seconds]
    [Time since reference or first frame: 1.068214850 seconds]
    Frame Number: 103
    Frame Length: 74 bytes (592 bits)
    Capture Length: 74 bytes (592 bits)
    [Frame is marked: False]
    [Frame is ignored: False]
    [Protocols in frame: eth:ethertype:ip:tcp]
    [Coloring Rule Name: HTTP]
    [Coloring Rule String: http || tcp.port == 80 || http2]
Ethernet II, Src: ASRockIncorp_17:a6:81 (a8:a1:59:17:a6:81), Dst: Ubiquiti_10:04:eb (ac:8b:a9:10:04:eb)
    Destination: Ubiquiti_10:04:eb (ac:8b:a9:10:04:eb)
        .... ..0. .... .... .... .... = LG bit: Globally unique address (factory default)
        .... ...0 .... .... .... .... = IG bit: Individual address (unicast)
    Source: ASRockIncorp_17:a6:81 (a8:a1:59:17:a6:81)
        .... ..0. .... .... .... .... = LG bit: Globally unique address (factory default)
        .... ...0 .... .... .... .... = IG bit: Individual address (unicast)
    Type: IPv4 (0x0800)
    [Stream index: 29]
Internet Protocol Version 4, Src: 10.1.17.80, Dst: 128.119.245.12
    0100 .... = Version: 4
    .... 0101 = Header Length: 20 bytes (5)
    Differentiated Services Field: 0x00 (DSCP: CS0, ECN: Not-ECT)
        0000 00.. = Differentiated Services Codepoint: Default (0)
        .... ..00 = Explicit Congestion Notification: Not ECN-Capable Transport (0)
    Total Length: 60
    Identification: 0x4f9e (20382)
    010. .... = Flags: 0x2, Don't fragment
        0... .... = Reserved bit: Not set
        .1.. .... = Don't fragment: Set
        ..0. .... = More fragments: Not set
    ...0 0000 0000 0000 = Fragment Offset: 0
    Time to Live: 64
    Protocol: TCP (6)
    Header Checksum: 0x5a49 [validation disabled]
    [Header checksum status: Unverified]
    Source Address: 10.1.17.80
    Destination Address: 128.119.245.12
    [Stream index: 26]
Transmission Control Protocol, Src Port: 53252, Dst Port: 80, Seq: 0, Len: 0
    Source Port: 53252
    Destination Port: 80
    [Stream index: 1]
    [Conversation completeness: Complete, WITH_DATA (31)]
        ..0. .... = RST: Absent
        ...1 .... = FIN: Present
        .... 1... = Data: Present
        .... .1.. = ACK: Present
        .... ..1. = SYN-ACK: Present
        .... ...1 = SYN: Present
        [Completeness Flags: ·FDASS]
    [TCP Segment Len: 0]
    Sequence Number: 0    (relative sequence number)
    Sequence Number (raw): 609975691
    [Next Sequence Number: 1    (relative sequence number)]
    Acknowledgment Number: 0
    Acknowledgment number (raw): 0
    1010 .... = Header Length: 40 bytes (10)
    Flags: 0x002 (SYN)
        000. .... .... = Reserved: Not set
        ...0 .... .... = Accurate ECN: Not set
        .... 0... .... = Congestion Window Reduced: Not set
        .... .0.. .... = ECN-Echo: Not set
        .... ..0. .... = Urgent: Not set
        .... ...0 .... = Acknowledgment: Not set
        .... .... 0... = Push: Not set
        .... .... .0.. = Reset: Not set
        .... .... ..1. = Syn: Set
            [Expert Info (Chat/Sequence): Connection establish request (SYN): server port 80]
                [Connection establish request (SYN): server port 80]
                [Severity level: Chat]
                [Group: Sequence]
        .... .... ...0 = Fin: Not set
        [TCP Flags: ··········S·]
    Window: 64240
    [Calculated window size: 64240]
    Checksum: 0x9103 [unverified]
    [Checksum Status: Unverified]
    Urgent Pointer: 0
    Options: (20 bytes), Maximum segment size, SACK permitted, Timestamps, No-Operation (NOP), Window scale
        TCP Option - Maximum segment size: 1460 bytes
            Kind: Maximum Segment Size (2)
            Length: 4
            MSS Value: 1460
        TCP Option - SACK permitted
            Kind: SACK Permitted (4)
            Length: 2
        TCP Option - Timestamps: TSval 2214311573, TSecr 0
            Kind: Time Stamp Option (8)
            Length: 10
            Timestamp value: 2214311573
            Timestamp echo reply: 0
        TCP Option - No-Operation (NOP)
            Kind: No-Operation (1)
        TCP Option - Window scale: 7 (multiply by 128)
            Kind: Window Scale (3)
            Length: 3
            Shift count: 7
            [Multiplier: 128]
    [Timestamps]
        [Time since first frame in this TCP stream: 0.000000000 seconds]
        [Time since previous frame in this TCP stream: 0.000000000 seconds]

Time           No.     Source                Destination           Protocol Length Info
1.234193258        116 128.119.245.12        10.1.17.80            TCP      74     80 → 53252 [SYN, ACK] Seq=0 Ack=1 Win=28960 Len=0 MSS=1460 SACK_PERM TSval=2716912864 TSecr=2214311573 WS=128

Frame 116: 74 bytes on wire (592 bits), 74 bytes captured (592 bits) on interface enp2s0f1, id 0
    Section number: 1
    Interface id: 0 (enp2s0f1)
        Interface name: enp2s0f1
    Encapsulation type: Ethernet (1)
    Arrival Time: Mar 12, 2025 16:22:34.611545004 -03
    UTC Arrival Time: Mar 12, 2025 19:22:34.611545004 UTC
    Epoch Arrival Time: 1741807354.611545004
    [Time shift for this packet: 0.000000000 seconds]
    [Time delta from previous captured frame: 0.032452258 seconds]
    [Time delta from previous displayed frame: 0.123446416 seconds]
    [Time since reference or first frame: 1.234193258 seconds]
    Frame Number: 116
    Frame Length: 74 bytes (592 bits)
    Capture Length: 74 bytes (592 bits)
    [Frame is marked: False]
    [Frame is ignored: False]
    [Protocols in frame: eth:ethertype:ip:tcp]
    [Coloring Rule Name: HTTP]
    [Coloring Rule String: http || tcp.port == 80 || http2]
Ethernet II, Src: Ubiquiti_10:04:eb (ac:8b:a9:10:04:eb), Dst: ASRockIncorp_17:a6:81 (a8:a1:59:17:a6:81)
    Destination: ASRockIncorp_17:a6:81 (a8:a1:59:17:a6:81)
        .... ..0. .... .... .... .... = LG bit: Globally unique address (factory default)
        .... ...0 .... .... .... .... = IG bit: Individual address (unicast)
    Source: Ubiquiti_10:04:eb (ac:8b:a9:10:04:eb)
        .... ..0. .... .... .... .... = LG bit: Globally unique address (factory default)
        .... ...0 .... .... .... .... = IG bit: Individual address (unicast)
    Type: IPv4 (0x0800)
    [Stream index: 29]
Internet Protocol Version 4, Src: 128.119.245.12, Dst: 10.1.17.80
    0100 .... = Version: 4
    .... 0101 = Header Length: 20 bytes (5)
    Differentiated Services Field: 0x00 (DSCP: CS0, ECN: Not-ECT)
        0000 00.. = Differentiated Services Codepoint: Default (0)
        .... ..00 = Explicit Congestion Notification: Not ECN-Capable Transport (0)
    Total Length: 60
    Identification: 0x0000 (0)
    010. .... = Flags: 0x2, Don't fragment
        0... .... = Reserved bit: Not set
        .1.. .... = Don't fragment: Set
        ..0. .... = More fragments: Not set
    ...0 0000 0000 0000 = Fragment Offset: 0
    Time to Live: 45
    Protocol: TCP (6)
    Header Checksum: 0xbce7 [validation disabled]
    [Header checksum status: Unverified]
    Source Address: 128.119.245.12
    Destination Address: 10.1.17.80
    [Stream index: 26]
Transmission Control Protocol, Src Port: 80, Dst Port: 53252, Seq: 0, Ack: 1, Len: 0
    Source Port: 80
    Destination Port: 53252
    [Stream index: 1]
    [Conversation completeness: Complete, WITH_DATA (31)]
        ..0. .... = RST: Absent
        ...1 .... = FIN: Present
        .... 1... = Data: Present
        .... .1.. = ACK: Present
        .... ..1. = SYN-ACK: Present
        .... ...1 = SYN: Present
        [Completeness Flags: ·FDASS]
    [TCP Segment Len: 0]
    Sequence Number: 0    (relative sequence number)
    Sequence Number (raw): 3266939790
    [Next Sequence Number: 1    (relative sequence number)]
    Acknowledgment Number: 1    (relative ack number)
    Acknowledgment number (raw): 609975692
    1010 .... = Header Length: 40 bytes (10)
    Flags: 0x012 (SYN, ACK)
        000. .... .... = Reserved: Not set
        ...0 .... .... = Accurate ECN: Not set
        .... 0... .... = Congestion Window Reduced: Not set
        .... .0.. .... = ECN-Echo: Not set
        .... ..0. .... = Urgent: Not set
        .... ...1 .... = Acknowledgment: Set
        .... .... 0... = Push: Not set
        .... .... .0.. = Reset: Not set
        .... .... ..1. = Syn: Set
            [Expert Info (Chat/Sequence): Connection establish acknowledge (SYN+ACK): server port 80]
                [Connection establish acknowledge (SYN+ACK): server port 80]
                [Severity level: Chat]
                [Group: Sequence]
        .... .... ...0 = Fin: Not set
        [TCP Flags: ·······A··S·]
    Window: 28960
    [Calculated window size: 28960]
    Checksum: 0xdc13 [unverified]
    [Checksum Status: Unverified]
    Urgent Pointer: 0
    Options: (20 bytes), Maximum segment size, SACK permitted, Timestamps, No-Operation (NOP), Window scale
        TCP Option - Maximum segment size: 1460 bytes
            Kind: Maximum Segment Size (2)
            Length: 4
            MSS Value: 1460
        TCP Option - SACK permitted
            Kind: SACK Permitted (4)
            Length: 2
        TCP Option - Timestamps: TSval 2716912864, TSecr 2214311573
            Kind: Time Stamp Option (8)
            Length: 10
            Timestamp value: 2716912864
            Timestamp echo reply: 2214311573
        TCP Option - No-Operation (NOP)
            Kind: No-Operation (1)
        TCP Option - Window scale: 7 (multiply by 128)
            Kind: Window Scale (3)
            Length: 3
            Shift count: 7
            [Multiplier: 128]
    [Timestamps]
        [Time since first frame in this TCP stream: 0.165978408 seconds]
        [Time since previous frame in this TCP stream: 0.165978408 seconds]
    [SEQ/ACK analysis]
        [This is an ACK to the segment in frame: 103]
        [The RTT to ACK the segment was: 0.165978408 seconds]
        [iRTT: 0.166039401 seconds]

Time           No.     Source                Destination           Protocol Length Info
1.234254251        117 10.1.17.80            128.119.245.12        TCP      66     53252 → 80 [ACK] Seq=1 Ack=1 Win=64256 Len=0 TSval=2214311739 TSecr=2716912864

Frame 117: 66 bytes on wire (528 bits), 66 bytes captured (528 bits) on interface enp2s0f1, id 0
    Section number: 1
    Interface id: 0 (enp2s0f1)
        Interface name: enp2s0f1
    Encapsulation type: Ethernet (1)
    Arrival Time: Mar 12, 2025 16:22:34.611605997 -03
    UTC Arrival Time: Mar 12, 2025 19:22:34.611605997 UTC
    Epoch Arrival Time: 1741807354.611605997
    [Time shift for this packet: 0.000000000 seconds]
    [Time delta from previous captured frame: 0.000060993 seconds]
    [Time delta from previous displayed frame: 0.000060993 seconds]
    [Time since reference or first frame: 1.234254251 seconds]
    Frame Number: 117
    Frame Length: 66 bytes (528 bits)
    Capture Length: 66 bytes (528 bits)
    [Frame is marked: False]
    [Frame is ignored: False]
    [Protocols in frame: eth:ethertype:ip:tcp]
    [Coloring Rule Name: HTTP]
    [Coloring Rule String: http || tcp.port == 80 || http2]
Ethernet II, Src: ASRockIncorp_17:a6:81 (a8:a1:59:17:a6:81), Dst: Ubiquiti_10:04:eb (ac:8b:a9:10:04:eb)
    Destination: Ubiquiti_10:04:eb (ac:8b:a9:10:04:eb)
        .... ..0. .... .... .... .... = LG bit: Globally unique address (factory default)
        .... ...0 .... .... .... .... = IG bit: Individual address (unicast)
    Source: ASRockIncorp_17:a6:81 (a8:a1:59:17:a6:81)
        .... ..0. .... .... .... .... = LG bit: Globally unique address (factory default)
        .... ...0 .... .... .... .... = IG bit: Individual address (unicast)
    Type: IPv4 (0x0800)
    [Stream index: 29]
Internet Protocol Version 4, Src: 10.1.17.80, Dst: 128.119.245.12
    0100 .... = Version: 4
    .... 0101 = Header Length: 20 bytes (5)
    Differentiated Services Field: 0x00 (DSCP: CS0, ECN: Not-ECT)
        0000 00.. = Differentiated Services Codepoint: Default (0)
        .... ..00 = Explicit Congestion Notification: Not ECN-Capable Transport (0)
    Total Length: 52
    Identification: 0x4f9f (20383)
    010. .... = Flags: 0x2, Don't fragment
        0... .... = Reserved bit: Not set
        .1.. .... = Don't fragment: Set
        ..0. .... = More fragments: Not set
    ...0 0000 0000 0000 = Fragment Offset: 0
    Time to Live: 64
    Protocol: TCP (6)
    Header Checksum: 0x5a50 [validation disabled]
    [Header checksum status: Unverified]
    Source Address: 10.1.17.80
    Destination Address: 128.119.245.12
    [Stream index: 26]
Transmission Control Protocol, Src Port: 53252, Dst Port: 80, Seq: 1, Ack: 1, Len: 0
    Source Port: 53252
    Destination Port: 80
    [Stream index: 1]
    [Conversation completeness: Complete, WITH_DATA (31)]
        ..0. .... = RST: Absent
        ...1 .... = FIN: Present
        .... 1... = Data: Present
        .... .1.. = ACK: Present
        .... ..1. = SYN-ACK: Present
        .... ...1 = SYN: Present
        [Completeness Flags: ·FDASS]
    [TCP Segment Len: 0]
    Sequence Number: 1    (relative sequence number)
    Sequence Number (raw): 609975692
    [Next Sequence Number: 1    (relative sequence number)]
    Acknowledgment Number: 1    (relative ack number)
    Acknowledgment number (raw): 3266939791
    1000 .... = Header Length: 32 bytes (8)
    Flags: 0x010 (ACK)
        000. .... .... = Reserved: Not set
        ...0 .... .... = Accurate ECN: Not set
        .... 0... .... = Congestion Window Reduced: Not set
        .... .0.. .... = ECN-Echo: Not set
        .... ..0. .... = Urgent: Not set
        .... ...1 .... = Acknowledgment: Set
        .... .... 0... = Push: Not set
        .... .... .0.. = Reset: Not set
        .... .... ..0. = Syn: Not set
        .... .... ...0 = Fin: Not set
        [TCP Flags: ·······A····]
    Window: 502
    [Calculated window size: 64256]
    [Window size scaling factor: 128]
    Checksum: 0x90fb [unverified]
    [Checksum Status: Unverified]
    Urgent Pointer: 0
    Options: (12 bytes), No-Operation (NOP), No-Operation (NOP), Timestamps
        TCP Option - No-Operation (NOP)
            Kind: No-Operation (1)
        TCP Option - No-Operation (NOP)
            Kind: No-Operation (1)
        TCP Option - Timestamps: TSval 2214311739, TSecr 2716912864
            Kind: Time Stamp Option (8)
            Length: 10
            Timestamp value: 2214311739
            Timestamp echo reply: 2716912864
    [Timestamps]
        [Time since first frame in this TCP stream: 0.166039401 seconds]
        [Time since previous frame in this TCP stream: 0.000060993 seconds]
    [SEQ/ACK analysis]
        [This is an ACK to the segment in frame: 116]
        [The RTT to ACK the segment was: 0.000060993 seconds]
        [iRTT: 0.166039401 seconds]

Time           No.     Source                Destination           Protocol Length Info
1.234444012        118 10.1.17.80            128.119.245.12        TCP      297    53252 → 80 [PSH, ACK] Seq=1 Ack=1 Win=64256 Len=231 TSval=2214311739 TSecr=2716912864 [TCP PDU reassembled in 294]

Frame 118: 297 bytes on wire (2376 bits), 297 bytes captured (2376 bits) on interface enp2s0f1, id 0
    Section number: 1
    Interface id: 0 (enp2s0f1)
        Interface name: enp2s0f1
    Encapsulation type: Ethernet (1)
    Arrival Time: Mar 12, 2025 16:22:34.611795758 -03
    UTC Arrival Time: Mar 12, 2025 19:22:34.611795758 UTC
    Epoch Arrival Time: 1741807354.611795758
    [Time shift for this packet: 0.000000000 seconds]
    [Time delta from previous captured frame: 0.000189761 seconds]
    [Time delta from previous displayed frame: 0.000189761 seconds]
    [Time since reference or first frame: 1.234444012 seconds]
    Frame Number: 118
    Frame Length: 297 bytes (2376 bits)
    Capture Length: 297 bytes (2376 bits)
    [Frame is marked: False]
    [Frame is ignored: False]
    [Protocols in frame: eth:ethertype:ip:tcp]
    [Coloring Rule Name: HTTP]
    [Coloring Rule String: http || tcp.port == 80 || http2]
Ethernet II, Src: ASRockIncorp_17:a6:81 (a8:a1:59:17:a6:81), Dst: Ubiquiti_10:04:eb (ac:8b:a9:10:04:eb)
    Destination: Ubiquiti_10:04:eb (ac:8b:a9:10:04:eb)
        .... ..0. .... .... .... .... = LG bit: Globally unique address (factory default)
        .... ...0 .... .... .... .... = IG bit: Individual address (unicast)
    Source: ASRockIncorp_17:a6:81 (a8:a1:59:17:a6:81)
        .... ..0. .... .... .... .... = LG bit: Globally unique address (factory default)
        .... ...0 .... .... .... .... = IG bit: Individual address (unicast)
    Type: IPv4 (0x0800)
    [Stream index: 29]
Internet Protocol Version 4, Src: 10.1.17.80, Dst: 128.119.245.12
    0100 .... = Version: 4
    .... 0101 = Header Length: 20 bytes (5)
    Differentiated Services Field: 0x00 (DSCP: CS0, ECN: Not-ECT)
        0000 00.. = Differentiated Services Codepoint: Default (0)
        .... ..00 = Explicit Congestion Notification: Not ECN-Capable Transport (0)
    Total Length: 283
    Identification: 0x4fa0 (20384)
    010. .... = Flags: 0x2, Don't fragment
        0... .... = Reserved bit: Not set
        .1.. .... = Don't fragment: Set
        ..0. .... = More fragments: Not set
    ...0 0000 0000 0000 = Fragment Offset: 0
    Time to Live: 64
    Protocol: TCP (6)
    Header Checksum: 0x5968 [validation disabled]
    [Header checksum status: Unverified]
    Source Address: 10.1.17.80
    Destination Address: 128.119.245.12
    [Stream index: 26]
Transmission Control Protocol, Src Port: 53252, Dst Port: 80, Seq: 1, Ack: 1, Len: 231
    Source Port: 53252
    Destination Port: 80
    [Stream index: 1]
    [Conversation completeness: Complete, WITH_DATA (31)]
        ..0. .... = RST: Absent
        ...1 .... = FIN: Present
        .... 1... = Data: Present
        .... .1.. = ACK: Present
        .... ..1. = SYN-ACK: Present
        .... ...1 = SYN: Present
        [Completeness Flags: ·FDASS]
    [TCP Segment Len: 231]
    Sequence Number: 1    (relative sequence number)
    Sequence Number (raw): 609975692
    [Next Sequence Number: 232    (relative sequence number)]
    Acknowledgment Number: 1    (relative ack number)
    Acknowledgment number (raw): 3266939791
    1000 .... = Header Length: 32 bytes (8)
    Flags: 0x018 (PSH, ACK)
        000. .... .... = Reserved: Not set
        ...0 .... .... = Accurate ECN: Not set
        .... 0... .... = Congestion Window Reduced: Not set
        .... .0.. .... = ECN-Echo: Not set
        .... ..0. .... = Urgent: Not set
        .... ...1 .... = Acknowledgment: Set
        .... .... 1... = Push: Set
        .... .... .0.. = Reset: Not set
        .... .... ..0. = Syn: Not set
        .... .... ...0 = Fin: Not set
        [TCP Flags: ·······AP···]
    Window: 502
    [Calculated window size: 64256]
    [Window size scaling factor: 128]
    Checksum: 0x91e2 [unverified]
    [Checksum Status: Unverified]
    Urgent Pointer: 0
    Options: (12 bytes), No-Operation (NOP), No-Operation (NOP), Timestamps
        TCP Option - No-Operation (NOP)
            Kind: No-Operation (1)
        TCP Option - No-Operation (NOP)
            Kind: No-Operation (1)
        TCP Option - Timestamps: TSval 2214311739, TSecr 2716912864
            Kind: Time Stamp Option (8)
            Length: 10
            Timestamp value: 2214311739
            Timestamp echo reply: 2716912864
    [Timestamps]
        [Time since first frame in this TCP stream: 0.166229162 seconds]
        [Time since previous frame in this TCP stream: 0.000189761 seconds]
    [SEQ/ACK analysis]
        [iRTT: 0.166039401 seconds]
        [Bytes in flight: 231]
        [Bytes sent since last PSH flag: 231]
    TCP payload (231 bytes)
    [Reassembled PDU in frame: 294]
    TCP segment data (231 bytes)

Time           No.     Source                Destination           Protocol Length Info
1.234754865        119 10.1.17.80            128.119.245.12        TCP      1514   53252 → 80 [ACK] Seq=232 Ack=1 Win=64256 Len=1448 TSval=2214311740 TSecr=2716912864 [TCP PDU reassembled in 294]

Frame 119: 1514 bytes on wire (12112 bits), 1514 bytes captured (12112 bits) on interface enp2s0f1, id 0
    Section number: 1
    Interface id: 0 (enp2s0f1)
        Interface name: enp2s0f1
    Encapsulation type: Ethernet (1)
    Arrival Time: Mar 12, 2025 16:22:34.612106611 -03
    UTC Arrival Time: Mar 12, 2025 19:22:34.612106611 UTC
    Epoch Arrival Time: 1741807354.612106611
    [Time shift for this packet: 0.000000000 seconds]
    [Time delta from previous captured frame: 0.000310853 seconds]
    [Time delta from previous displayed frame: 0.000310853 seconds]
    [Time since reference or first frame: 1.234754865 seconds]
    Frame Number: 119
    Frame Length: 1514 bytes (12112 bits)
    Capture Length: 1514 bytes (12112 bits)
    [Frame is marked: False]
    [Frame is ignored: False]
    [Protocols in frame: eth:ethertype:ip:tcp]
    [Coloring Rule Name: HTTP]
    [Coloring Rule String: http || tcp.port == 80 || http2]
Ethernet II, Src: ASRockIncorp_17:a6:81 (a8:a1:59:17:a6:81), Dst: Ubiquiti_10:04:eb (ac:8b:a9:10:04:eb)
    Destination: Ubiquiti_10:04:eb (ac:8b:a9:10:04:eb)
        .... ..0. .... .... .... .... = LG bit: Globally unique address (factory default)
        .... ...0 .... .... .... .... = IG bit: Individual address (unicast)
    Source: ASRockIncorp_17:a6:81 (a8:a1:59:17:a6:81)
        .... ..0. .... .... .... .... = LG bit: Globally unique address (factory default)
        .... ...0 .... .... .... .... = IG bit: Individual address (unicast)
    Type: IPv4 (0x0800)
    [Stream index: 29]
Internet Protocol Version 4, Src: 10.1.17.80, Dst: 128.119.245.12
    0100 .... = Version: 4
    .... 0101 = Header Length: 20 bytes (5)
    Differentiated Services Field: 0x00 (DSCP: CS0, ECN: Not-ECT)
        0000 00.. = Differentiated Services Codepoint: Default (0)
        .... ..00 = Explicit Congestion Notification: Not ECN-Capable Transport (0)
    Total Length: 1500
    Identification: 0x4fa1 (20385)
    010. .... = Flags: 0x2, Don't fragment
        0... .... = Reserved bit: Not set
        .1.. .... = Don't fragment: Set
        ..0. .... = More fragments: Not set
    ...0 0000 0000 0000 = Fragment Offset: 0
    Time to Live: 64
    Protocol: TCP (6)
    Header Checksum: 0x54a6 [validation disabled]
    [Header checksum status: Unverified]
    Source Address: 10.1.17.80
    Destination Address: 128.119.245.12
    [Stream index: 26]
Transmission Control Protocol, Src Port: 53252, Dst Port: 80, Seq: 232, Ack: 1, Len: 1448
    Source Port: 53252
    Destination Port: 80
    [Stream index: 1]
    [Conversation completeness: Complete, WITH_DATA (31)]
        ..0. .... = RST: Absent
        ...1 .... = FIN: Present
        .... 1... = Data: Present
        .... .1.. = ACK: Present
        .... ..1. = SYN-ACK: Present
        .... ...1 = SYN: Present
        [Completeness Flags: ·FDASS]
    [TCP Segment Len: 1448]
    Sequence Number: 232    (relative sequence number)
    Sequence Number (raw): 609975923
    [Next Sequence Number: 1680    (relative sequence number)]
    Acknowledgment Number: 1    (relative ack number)
    Acknowledgment number (raw): 3266939791
    1000 .... = Header Length: 32 bytes (8)
    Flags: 0x010 (ACK)
        000. .... .... = Reserved: Not set
        ...0 .... .... = Accurate ECN: Not set
        .... 0... .... = Congestion Window Reduced: Not set
        .... .0.. .... = ECN-Echo: Not set
        .... ..0. .... = Urgent: Not set
        .... ...1 .... = Acknowledgment: Set
        .... .... 0... = Push: Not set
        .... .... .0.. = Reset: Not set
        .... .... ..0. = Syn: Not set
        .... .... ...0 = Fin: Not set
        [TCP Flags: ·······A····]
    Window: 502
    [Calculated window size: 64256]
    [Window size scaling factor: 128]
    Checksum: 0x96a3 [unverified]
    [Checksum Status: Unverified]
    Urgent Pointer: 0
    Options: (12 bytes), No-Operation (NOP), No-Operation (NOP), Timestamps
        TCP Option - No-Operation (NOP)
            Kind: No-Operation (1)
        TCP Option - No-Operation (NOP)
            Kind: No-Operation (1)
        TCP Option - Timestamps: TSval 2214311740, TSecr 2716912864
            Kind: Time Stamp Option (8)
            Length: 10
            Timestamp value: 2214311740
            Timestamp echo reply: 2716912864
    [Timestamps]
        [Time since first frame in this TCP stream: 0.166540015 seconds]
        [Time since previous frame in this TCP stream: 0.000310853 seconds]
    [SEQ/ACK analysis]
        [iRTT: 0.166039401 seconds]
        [Bytes in flight: 1679]
        [Bytes sent since last PSH flag: 1448]
    TCP payload (1448 bytes)
    [Reassembled PDU in frame: 294]
    TCP segment data (1448 bytes)

Time           No.     Source                Destination           Protocol Length Info
1.234764952        120 10.1.17.80            128.119.245.12        TCP      1514   53252 → 80 [PSH, ACK] Seq=1680 Ack=1 Win=64256 Len=1448 TSval=2214311740 TSecr=2716912864 [TCP PDU reassembled in 294]

Frame 120: 1514 bytes on wire (12112 bits), 1514 bytes captured (12112 bits) on interface enp2s0f1, id 0
    Section number: 1
    Interface id: 0 (enp2s0f1)
        Interface name: enp2s0f1
    Encapsulation type: Ethernet (1)
    Arrival Time: Mar 12, 2025 16:22:34.612116698 -03
    UTC Arrival Time: Mar 12, 2025 19:22:34.612116698 UTC
    Epoch Arrival Time: 1741807354.612116698
    [Time shift for this packet: 0.000000000 seconds]
    [Time delta from previous captured frame: 0.000010087 seconds]
    [Time delta from previous displayed frame: 0.000010087 seconds]
    [Time since reference or first frame: 1.234764952 seconds]
    Frame Number: 120
    Frame Length: 1514 bytes (12112 bits)
    Capture Length: 1514 bytes (12112 bits)
    [Frame is marked: False]
    [Frame is ignored: False]
    [Protocols in frame: eth:ethertype:ip:tcp]
    [Coloring Rule Name: HTTP]
    [Coloring Rule String: http || tcp.port == 80 || http2]
Ethernet II, Src: ASRockIncorp_17:a6:81 (a8:a1:59:17:a6:81), Dst: Ubiquiti_10:04:eb (ac:8b:a9:10:04:eb)
    Destination: Ubiquiti_10:04:eb (ac:8b:a9:10:04:eb)
        .... ..0. .... .... .... .... = LG bit: Globally unique address (factory default)
        .... ...0 .... .... .... .... = IG bit: Individual address (unicast)
    Source: ASRockIncorp_17:a6:81 (a8:a1:59:17:a6:81)
        .... ..0. .... .... .... .... = LG bit: Globally unique address (factory default)
        .... ...0 .... .... .... .... = IG bit: Individual address (unicast)
    Type: IPv4 (0x0800)
    [Stream index: 29]
Internet Protocol Version 4, Src: 10.1.17.80, Dst: 128.119.245.12
    0100 .... = Version: 4
    .... 0101 = Header Length: 20 bytes (5)
    Differentiated Services Field: 0x00 (DSCP: CS0, ECN: Not-ECT)
        0000 00.. = Differentiated Services Codepoint: Default (0)
        .... ..00 = Explicit Congestion Notification: Not ECN-Capable Transport (0)
    Total Length: 1500
    Identification: 0x4fa2 (20386)
    010. .... = Flags: 0x2, Don't fragment
        0... .... = Reserved bit: Not set
        .1.. .... = Don't fragment: Set
        ..0. .... = More fragments: Not set
    ...0 0000 0000 0000 = Fragment Offset: 0
    Time to Live: 64
    Protocol: TCP (6)
    Header Checksum: 0x54a5 [validation disabled]
    [Header checksum status: Unverified]
    Source Address: 10.1.17.80
    Destination Address: 128.119.245.12
    [Stream index: 26]
Transmission Control Protocol, Src Port: 53252, Dst Port: 80, Seq: 1680, Ack: 1, Len: 1448
    Source Port: 53252
    Destination Port: 80
    [Stream index: 1]
    [Conversation completeness: Complete, WITH_DATA (31)]
        ..0. .... = RST: Absent
        ...1 .... = FIN: Present
        .... 1... = Data: Present
        .... .1.. = ACK: Present
        .... ..1. = SYN-ACK: Present
        .... ...1 = SYN: Present
        [Completeness Flags: ·FDASS]
    [TCP Segment Len: 1448]
    Sequence Number: 1680    (relative sequence number)
    Sequence Number (raw): 609977371
    [Next Sequence Number: 3128    (relative sequence number)]
    Acknowledgment Number: 1    (relative ack number)
    Acknowledgment number (raw): 3266939791
    1000 .... = Header Length: 32 bytes (8)
    Flags: 0x018 (PSH, ACK)
        000. .... .... = Reserved: Not set
        ...0 .... .... = Accurate ECN: Not set
        .... 0... .... = Congestion Window Reduced: Not set
        .... .0.. .... = ECN-Echo: Not set
        .... ..0. .... = Urgent: Not set
        .... ...1 .... = Acknowledgment: Set
        .... .... 1... = Push: Set
        .... .... .0.. = Reset: Not set
        .... .... ..0. = Syn: Not set
        .... .... ...0 = Fin: Not set
        [TCP Flags: ·······AP···]
    Window: 502
    [Calculated window size: 64256]
    [Window size scaling factor: 128]
    Checksum: 0x96a3 [unverified]
    [Checksum Status: Unverified]
    Urgent Pointer: 0
    Options: (12 bytes), No-Operation (NOP), No-Operation (NOP), Timestamps
        TCP Option - No-Operation (NOP)
            Kind: No-Operation (1)
        TCP Option - No-Operation (NOP)
            Kind: No-Operation (1)
        TCP Option - Timestamps: TSval 2214311740, TSecr 2716912864
            Kind: Time Stamp Option (8)
            Length: 10
            Timestamp value: 2214311740
            Timestamp echo reply: 2716912864
    [Timestamps]
        [Time since first frame in this TCP stream: 0.166550102 seconds]
        [Time since previous frame in this TCP stream: 0.000010087 seconds]
    [SEQ/ACK analysis]
        [iRTT: 0.166039401 seconds]
        [Bytes in flight: 3127]
        [Bytes sent since last PSH flag: 2896]
    TCP payload (1448 bytes)
    [Reassembled PDU in frame: 294]
    TCP segment data (1448 bytes)

Time           No.     Source                Destination           Protocol Length Info
1.234865908        121 10.1.17.80            128.119.245.12        TCP      1514   53252 → 80 [ACK] Seq=3128 Ack=1 Win=64256 Len=1448 TSval=2214311740 TSecr=2716912864 [TCP PDU reassembled in 294]

Frame 121: 1514 bytes on wire (12112 bits), 1514 bytes captured (12112 bits) on interface enp2s0f1, id 0
    Section number: 1
    Interface id: 0 (enp2s0f1)
        Interface name: enp2s0f1
    Encapsulation type: Ethernet (1)
    Arrival Time: Mar 12, 2025 16:22:34.612217654 -03
    UTC Arrival Time: Mar 12, 2025 19:22:34.612217654 UTC
    Epoch Arrival Time: 1741807354.612217654
    [Time shift for this packet: 0.000000000 seconds]
    [Time delta from previous captured frame: 0.000100956 seconds]
    [Time delta from previous displayed frame: 0.000100956 seconds]
    [Time since reference or first frame: 1.234865908 seconds]
    Frame Number: 121
    Frame Length: 1514 bytes (12112 bits)
    Capture Length: 1514 bytes (12112 bits)
    [Frame is marked: False]
    [Frame is ignored: False]
    [Protocols in frame: eth:ethertype:ip:tcp]
    [Coloring Rule Name: HTTP]
    [Coloring Rule String: http || tcp.port == 80 || http2]
Ethernet II, Src: ASRockIncorp_17:a6:81 (a8:a1:59:17:a6:81), Dst: Ubiquiti_10:04:eb (ac:8b:a9:10:04:eb)
    Destination: Ubiquiti_10:04:eb (ac:8b:a9:10:04:eb)
        .... ..0. .... .... .... .... = LG bit: Globally unique address (factory default)
        .... ...0 .... .... .... .... = IG bit: Individual address (unicast)
    Source: ASRockIncorp_17:a6:81 (a8:a1:59:17:a6:81)
        .... ..0. .... .... .... .... = LG bit: Globally unique address (factory default)
        .... ...0 .... .... .... .... = IG bit: Individual address (unicast)
    Type: IPv4 (0x0800)
    [Stream index: 29]
Internet Protocol Version 4, Src: 10.1.17.80, Dst: 128.119.245.12
    0100 .... = Version: 4
    .... 0101 = Header Length: 20 bytes (5)
    Differentiated Services Field: 0x00 (DSCP: CS0, ECN: Not-ECT)
        0000 00.. = Differentiated Services Codepoint: Default (0)
        .... ..00 = Explicit Congestion Notification: Not ECN-Capable Transport (0)
    Total Length: 1500
    Identification: 0x4fa3 (20387)
    010. .... = Flags: 0x2, Don't fragment
        0... .... = Reserved bit: Not set
        .1.. .... = Don't fragment: Set
        ..0. .... = More fragments: Not set
    ...0 0000 0000 0000 = Fragment Offset: 0
    Time to Live: 64
    Protocol: TCP (6)
    Header Checksum: 0x54a4 [validation disabled]
    [Header checksum status: Unverified]
    Source Address: 10.1.17.80
    Destination Address: 128.119.245.12
    [Stream index: 26]
Transmission Control Protocol, Src Port: 53252, Dst Port: 80, Seq: 3128, Ack: 1, Len: 1448
    Source Port: 53252
    Destination Port: 80
    [Stream index: 1]
    [Conversation completeness: Complete, WITH_DATA (31)]
        ..0. .... = RST: Absent
        ...1 .... = FIN: Present
        .... 1... = Data: Present
        .... .1.. = ACK: Present
        .... ..1. = SYN-ACK: Present
        .... ...1 = SYN: Present
        [Completeness Flags: ·FDASS]
    [TCP Segment Len: 1448]
    Sequence Number: 3128    (relative sequence number)
    Sequence Number (raw): 609978819
    [Next Sequence Number: 4576    (relative sequence number)]
    Acknowledgment Number: 1    (relative ack number)
    Acknowledgment number (raw): 3266939791
    1000 .... = Header Length: 32 bytes (8)
    Flags: 0x010 (ACK)
        000. .... .... = Reserved: Not set
        ...0 .... .... = Accurate ECN: Not set
        .... 0... .... = Congestion Window Reduced: Not set
        .... .0.. .... = ECN-Echo: Not set
        .... ..0. .... = Urgent: Not set
        .... ...1 .... = Acknowledgment: Set
        .... .... 0... = Push: Not set
        .... .... .0.. = Reset: Not set
        .... .... ..0. = Syn: Not set
        .... .... ...0 = Fin: Not set
        [TCP Flags: ·······A····]
    Window: 502
    [Calculated window size: 64256]
    [Window size scaling factor: 128]
    Checksum: 0x96a3 [unverified]
    [Checksum Status: Unverified]
    Urgent Pointer: 0
    Options: (12 bytes), No-Operation (NOP), No-Operation (NOP), Timestamps
        TCP Option - No-Operation (NOP)
            Kind: No-Operation (1)
        TCP Option - No-Operation (NOP)
            Kind: No-Operation (1)
        TCP Option - Timestamps: TSval 2214311740, TSecr 2716912864
            Kind: Time Stamp Option (8)
            Length: 10
            Timestamp value: 2214311740
            Timestamp echo reply: 2716912864
    [Timestamps]
        [Time since first frame in this TCP stream: 0.166651058 seconds]
        [Time since previous frame in this TCP stream: 0.000100956 seconds]
    [SEQ/ACK analysis]
        [iRTT: 0.166039401 seconds]
        [Bytes in flight: 4575]
        [Bytes sent since last PSH flag: 1448]
    TCP payload (1448 bytes)
    [Reassembled PDU in frame: 294]
    TCP segment data (1448 bytes)

Time           No.     Source                Destination           Protocol Length Info
1.234877808        122 10.1.17.80            128.119.245.12        TCP      1514   53252 → 80 [PSH, ACK] Seq=4576 Ack=1 Win=64256 Len=1448 TSval=2214311740 TSecr=2716912864 [TCP PDU reassembled in 294]

Frame 122: 1514 bytes on wire (12112 bits), 1514 bytes captured (12112 bits) on interface enp2s0f1, id 0
    Section number: 1
    Interface id: 0 (enp2s0f1)
        Interface name: enp2s0f1
    Encapsulation type: Ethernet (1)
    Arrival Time: Mar 12, 2025 16:22:34.612229554 -03
    UTC Arrival Time: Mar 12, 2025 19:22:34.612229554 UTC
    Epoch Arrival Time: 1741807354.612229554
    [Time shift for this packet: 0.000000000 seconds]
    [Time delta from previous captured frame: 0.000011900 seconds]
    [Time delta from previous displayed frame: 0.000011900 seconds]
    [Time since reference or first frame: 1.234877808 seconds]
    Frame Number: 122
    Frame Length: 1514 bytes (12112 bits)
    Capture Length: 1514 bytes (12112 bits)
    [Frame is marked: False]
    [Frame is ignored: False]
    [Protocols in frame: eth:ethertype:ip:tcp]
    [Coloring Rule Name: HTTP]
    [Coloring Rule String: http || tcp.port == 80 || http2]
Ethernet II, Src: ASRockIncorp_17:a6:81 (a8:a1:59:17:a6:81), Dst: Ubiquiti_10:04:eb (ac:8b:a9:10:04:eb)
    Destination: Ubiquiti_10:04:eb (ac:8b:a9:10:04:eb)
        .... ..0. .... .... .... .... = LG bit: Globally unique address (factory default)
        .... ...0 .... .... .... .... = IG bit: Individual address (unicast)
    Source: ASRockIncorp_17:a6:81 (a8:a1:59:17:a6:81)
        .... ..0. .... .... .... .... = LG bit: Globally unique address (factory default)
        .... ...0 .... .... .... .... = IG bit: Individual address (unicast)
    Type: IPv4 (0x0800)
    [Stream index: 29]
Internet Protocol Version 4, Src: 10.1.17.80, Dst: 128.119.245.12
    0100 .... = Version: 4
    .... 0101 = Header Length: 20 bytes (5)
    Differentiated Services Field: 0x00 (DSCP: CS0, ECN: Not-ECT)
        0000 00.. = Differentiated Services Codepoint: Default (0)
        .... ..00 = Explicit Congestion Notification: Not ECN-Capable Transport (0)
    Total Length: 1500
    Identification: 0x4fa4 (20388)
    010. .... = Flags: 0x2, Don't fragment
        0... .... = Reserved bit: Not set
        .1.. .... = Don't fragment: Set
        ..0. .... = More fragments: Not set
    ...0 0000 0000 0000 = Fragment Offset: 0
    Time to Live: 64
    Protocol: TCP (6)
    Header Checksum: 0x54a3 [validation disabled]
    [Header checksum status: Unverified]
    Source Address: 10.1.17.80
    Destination Address: 128.119.245.12
    [Stream index: 26]
Transmission Control Protocol, Src Port: 53252, Dst Port: 80, Seq: 4576, Ack: 1, Len: 1448
    Source Port: 53252
    Destination Port: 80
    [Stream index: 1]
    [Conversation completeness: Complete, WITH_DATA (31)]
        ..0. .... = RST: Absent
        ...1 .... = FIN: Present
        .... 1... = Data: Present
        .... .1.. = ACK: Present
        .... ..1. = SYN-ACK: Present
        .... ...1 = SYN: Present
        [Completeness Flags: ·FDASS]
    [TCP Segment Len: 1448]
    Sequence Number: 4576    (relative sequence number)
    Sequence Number (raw): 609980267
    [Next Sequence Number: 6024    (relative sequence number)]
    Acknowledgment Number: 1    (relative ack number)
    Acknowledgment number (raw): 3266939791
    1000 .... = Header Length: 32 bytes (8)
    Flags: 0x018 (PSH, ACK)
        000. .... .... = Reserved: Not set
        ...0 .... .... = Accurate ECN: Not set
        .... 0... .... = Congestion Window Reduced: Not set
        .... .0.. .... = ECN-Echo: Not set
        .... ..0. .... = Urgent: Not set
        .... ...1 .... = Acknowledgment: Set
        .... .... 1... = Push: Set
        .... .... .0.. = Reset: Not set
        .... .... ..0. = Syn: Not set
        .... .... ...0 = Fin: Not set
        [TCP Flags: ·······AP···]
    Window: 502
    [Calculated window size: 64256]
    [Window size scaling factor: 128]
    Checksum: 0x96a3 [unverified]
    [Checksum Status: Unverified]
    Urgent Pointer: 0
    Options: (12 bytes), No-Operation (NOP), No-Operation (NOP), Timestamps
        TCP Option - No-Operation (NOP)
            Kind: No-Operation (1)
        TCP Option - No-Operation (NOP)
            Kind: No-Operation (1)
        TCP Option - Timestamps: TSval 2214311740, TSecr 2716912864
            Kind: Time Stamp Option (8)
            Length: 10
            Timestamp value: 2214311740
            Timestamp echo reply: 2716912864
    [Timestamps]
